{
  "schema": "artifactforge-fixture-spec-v2",
  "purpose": "public-reproducible-fixture",
  "fixture_id": "windows-dropper-001",
  "family": "windows",
  "story": "windows-dropper-v1",
  "profile": {
    "id": "windows-loose-v2",
    "hostname": "WKSTN-01",
    "username": "v"
  },
  "seed_hex": "0123456789abcdef0123456789abcdef0123456789abcdef0123456789abcdef",
  "causal_clock": {
    "profile": "artifactforge-causal-clock-v1",
    "anchor_unix_ns": 1741431634000000000
  }
}
