{
  "schema": "artifactforge-fixture-spec-v2",
  "purpose": "public-reproducible-fixture",
  "fixture_id": "windows-download-only-001",
  "family": "windows",
  "story": "windows-download-only-v1",
  "profile": {
    "id": "windows-loose-v2",
    "hostname": "WKSTN-02",
    "username": "v"
  },
  "seed_hex": "fedcba9876543210fedcba9876543210fedcba9876543210fedcba9876543210",
  "causal_clock": {
    "profile": "artifactforge-causal-clock-v1",
    "anchor_unix_ns": 1681257103000000000
  }
}
